{
	"schema_version": "notice_tool_contracts.v1",
	"tool_name": "campus_notice_discover",
	"packet_kind": "result",
	"result": {
		"query_text": "近期采购公告",
		"outcome": "resolved_current",
		"notice_cards": [
			{
				"notice_id": "notice:muc:2026-001",
				"title": "采购公告",
				"source_family": "official_web_public_notice",
				"source_url": "https://example.edu/notice/2026-001"
			}
		]
	}
}
